searchStrings	author_id	citedby_url	container_type	eprint_url	filled	gsrank	num_citations	pub_url	source	url_add_sclib	url_related_articles	url_scholarbib	['bib']abstract	['bib']author	['bib']bib_id	['bib']booktitle	['bib']institution	['bib']journal	['bib']month	['bib']note	['bib']number	['bib']organization	['bib']pages	['bib']pub_type	['bib']pub_year	['bib']publisher	['bib']school	['bib']title	['bib']venue	['bib']volume
[33]	['zfFD848AAAAJ', '5EsGtt0AAAAJ']	/scholar?cites=11565073624004068432&as_sdt=2005&sciodt=0,5&hl=en	Publication	http://calimar.com/mbone_use_case_estimation.pdf	True	1	3	https://incose.onlinelibrary.wiley.com/doi/abs/10.1002/j.2334-5837.2011.tb01189.x	PublicationSource.PUBLICATION_SEARCH_SNIPPET	/citations?hl=en&xsrf=&continue=/scholar%3Fq%3D1.4.%2B3%2BApplying%2BSystems%2BEngineering%2BModeling%2BLanguage%2B(SysML)%2Bto%2BSystem%2BEffort%2BEstimation%2BUtilizing%2BUse%2BCase%2BPoints%26hl%3Den%26as_sdt%3D0,5&citilm=1&update_op=library_add&info=UIQAyC9lf6AJ&ei=sl_wZd3YH4C6y9YP4uajqAE&json=	/scholar?q=related:UIQAyC9lf6AJ:scholar.google.com/&scioq=1.4.+3+Applying+Systems+Engineering+Modeling+Language+(SysML)+to+System+Effort+Estimation+Utilizing+Use+Case+Points&hl=en&as_sdt=0,5	/scholar?hl=en&q=info:UIQAyC9lf6AJ:scholar.google.com/&output=cite&scirp=0&hl=en	This paper proposes that as model based systems engineering begins to play a larger role in system development it may be utilized in estimating systems effort, making model based systems engineering more valuable to system engineering. This paper proposes to extend the Use Case Points (UCP) estimating approach, used by some software engineers, to SysML for estimating the systems engineering effort. The paper reviews literature that encourages the notion of a UCP method for Systems Engineering (UCPSE). Finally the	Bone, Mary Alice and Cloutier, Robert	bone20111	INCOSE International Symposium	NA	NA	NA	NA	1	Wiley Online Library	114--127	inproceedings	2011	NA	NA	1.4. 3 Applying Systems Engineering Modeling Language (SysML) to System Effort Estimation Utilizing Use Case Points	INCOSE International Symposium	21
[1, 2, 3, 4, 5, 6, 31, 32, 33]	['JcyHeLYAAAAJ', '', '']	/scholar?cites=240430573422071082&as_sdt=2005&sciodt=0,5&hl=en	Publication	https://citeseerx.ist.psu.edu/document?repid=rep1&type=pdf&doi=0864fd00d9328c8a2903ecef3d1abbc8a9f89ed9	True	1	6	https://books.google.com/books?hl=en&lr=&id=1fFdhxO8mnIC&oi=fnd&pg=PA72&dq=1.5+ISO+Transposition+and+Clarifications+of+the+COSMIC+FFP+Method+of+Functional+Sizing&ots=MLAp1hPAC6&sig=loL9tb2KoG_OhPYMEO_wpl2mdkA	PublicationSource.PUBLICATION_SEARCH_SNIPPET	/citations?hl=en&xsrf=&continue=/scholar%3Fq%3D1.5%2BISO%2BTransposition%2Band%2BClarifications%2Bof%2Bthe%2BCOSMIC%2BFFP%2BMethod%2Bof%2BFunctional%2BSizing%26hl%3Den%26as_sdt%3D0,5&citilm=1&update_op=library_add&info=Kk33KVUuVgMJ&ei=1nXcZejWFvXMy9YPpY2Q0A8&json=	/scholar?q=related:Kk33KVUuVgMJ:scholar.google.com/&scioq=1.5+ISO+Transposition+and+Clarifications+of+the+COSMIC+FFP+Method+of+Functional+Sizing&hl=en&as_sdt=0,5	/scholar?hl=en&q=info:Kk33KVUuVgMJ:scholar.google.com/&output=cite&scirp=0&hl=en	Unfortunately, the ISO/IEC 14143-1 terms and definitions cannot be changed until a  formal revision process is started. In the meantime, the ISO/ IEC standard version of the  COSMIC FFP method must adopt the term already defined in ISO/IEC 14143-1, and since  our goal is to remain compatible and in sync with the international standard, the MM V2. 2  must adopt this definition. However, in the latter the  We believe that the new ISO/IEC  19761 standard for the COSMIC FFP method and the new MM V2. 2 will significantly	Abran, Alain and Fagg, Peter and Meli, Roberto and Symons, Charles R	abran20161	NA	NA	COSMIC Function Points: Theory and Advanced Practices	NA	NA	NA	NA	72	article	2016	CRC Press	NA	1.5 ISO Transposition and Clarifications of the COSMIC FFP Method of Functional Sizing	COSMIC Function Points …	NA
[4, 6, 33]	['cnGGpAIAAAAJ']	/scholar?cites=16017876355177795081&as_sdt=2005&sciodt=0,5&hl=en	Publication	NA	True	1	64	https://www.emerald.com/insight/content/doi/10.1108/09544780710745649/full/html	PublicationSource.PUBLICATION_SEARCH_SNIPPET	/citations?hl=en&xsrf=&continue=/scholar%3Fq%3DPerforming%2Bthe%2BMeasurement%2BProcess%26hl%3Den%26as_sdt%3D0,5&citilm=1&update_op=library_add&info=CU6Avq3tSt4J&ei=dGDwZd7IKbec6rQPptSWqA8&json=	/scholar?q=related:CU6Avq3tSt4J:scholar.google.com/&scioq=Performing+the+Measurement+Process&hl=en&as_sdt=0,5	/scholar?hl=en&q=info:CU6Avq3tSt4J:scholar.google.com/&output=cite&scirp=0&hl=en	of errors in the performance measurement process, we started with the places where people  conduct daily organizational activities, in particular, measuring activities. The subsequent	Elg, Mattias	elg2007process	NA	NA	The TQM Magazine	NA	NA	3	NA	217--228	article	2007	Emerald Group Publishing Limited	NA	The process of constructing performance measurement	The TQM Magazine	19
[4, 5, 6, 31, 33]	['']	/scholar?cites=261860580208250801&as_sdt=2005&sciodt=0,5&hl=en	Publication	https://www.ifpug.org/wp-content/uploads/2021/10/MetricViewsFebruary2016.pdf	True	1	5	https://www.ifpug.org/wp-content/uploads/2021/10/MetricViewsFebruary2016.pdf	PublicationSource.PUBLICATION_SEARCH_SNIPPET	/citations?hl=en&xsrf=&continue=/scholar%3Fq%3DIn%2Bthis%2Bedition%26hl%3Den%26as_sdt%3D0,5&citilm=1&update_op=library_add&info=sY_9b89QogMJ&ei=eVrwZZbWJfqXy9YPu4an-A8&json=	/scholar?q=related:sY_9b89QogMJ:scholar.google.com/&scioq=In+this+edition&hl=en&as_sdt=0,5	/scholar?hl=en&q=info:sY_9b89QogMJ:scholar.google.com/&output=cite&scirp=0&hl=en	Defect potentials and defect removal efficiency (DRE) are useful quality metrics developed by IBM circa 1973 and widely used by technology companies as well as by banks, insurance companies, and other organizations with large software staffs. Defect potentials are the sum total of bugs found in requirements, architecture, design, code, and other sources of error. The approximate US average for defect potentials is shown in table 1 using IFPUG function points version 4.3:. Function point metrics were also invented by IBM in the same time period	Edition, Gauteng	edition2019edition	NA	NA	ISBN-13	NA	NA	NA	NA	978--0262693561	article	2019	NA	NA	In this edition	ISBN-13	NA
[4, 5, 6, 33]	['']	NA	Publication	NA	True	1	0	https://link.springer.com/content/pdf/10.1007/978-3-319-03629-8.pdf#page=444	PublicationSource.PUBLICATION_SEARCH_SNIPPET	/citations?hl=en&xsrf=&continue=/scholar%3Fq%3D17.6%2BLast%2BBut%2BNot%2BLeast...%26hl%3Den%26as_sdt%3D0,5&citilm=1&update_op=library_add&info=nm3uo5Cp6WEJ&ei=01_wZcnVHr-46rQP7ZK8qAg&json=	/scholar?q=related:nm3uo5Cp6WEJ:scholar.google.com/&scioq=17.6+Last+But+Not+Least...&hl=en&as_sdt=0,5	/scholar?hl=en&q=info:nm3uo5Cp6WEJ:scholar.google.com/&output=cite&scirp=0&hl=en	Many years of experience gained over multiple studies and context show that simple estimation  methods work at least as effectively as complex ones. Yet, the cost of introducing, using,	J{\o}rgensen, Magne	jorgensen17	NA	NA	Software Project Effort Estimation	NA	NA	NA	NA	430	article	NA	Springer	NA	17.6 Last But Not Least...	Software Project Effort Estimation	NA
[4, 33]	['', 'TQMpoh8AAAAJ', 'znwO0ecAAAAJ', '', '', '']	/scholar?cites=13111622239562355265&as_sdt=2005&sciodt=0,5&hl=en	Publication	NA	True	1	3	https://books.google.com/books?hl=en&lr=&id=6kshjwWdJDwC&oi=fnd&pg=PR5&dq=Software+Engineering,+Business+Continuity,+and+Education:+International+Conferences,+ASEA,+DRBC+and+EL+2011,+Held+as+Part+of+the+Future+Generation+%E2%80%A6&ots=Xur6EDCDPa&sig=_sEzYkuZNU8W2X_aJl6qfFqYkso	PublicationSource.PUBLICATION_SEARCH_SNIPPET	/citations?hl=en&xsrf=&continue=/scholar%3Fq%3DSoftware%2BEngineering,%2BBusiness%2BContinuity,%2Band%2BEducation:%2BInternational%2BConferences,%2BASEA,%2BDRBC%2Band%2BEL%2B2011,%2BHeld%2Bas%2BPart%2Bof%2Bthe%2BFuture%2BGeneration%2B%25E2%2580%25A6%26hl%3Den%26as_sdt%3D0,5&citilm=1&update_op=library_add&info=QdI5YvXW9bUJ&ei=tWDwZYT-IIC6y9YP4uajqAE&json=	/scholar?q=related:QdI5YvXW9bUJ:scholar.google.com/&scioq=Software+Engineering,+Business+Continuity,+and+Education:+International+Conferences,+ASEA,+DRBC+and+EL+2011,+Held+as+Part+of+the+Future+Generation+%E2%80%A6&hl=en&as_sdt=0,5	/scholar?hl=en&q=info:QdI5YvXW9bUJ:scholar.google.com/&output=cite&scirp=0&hl=en	This book comprises selected papers of the International Conferences, ASEA, DRBC and EL 2011, held as Part of the Future Generation Information Technology Conference, FGIT 2011, in Conjunction with GDC 2011, Jeju Island, Korea, in December 2011. The papers presented were carefully reviewed and selected from numerous submissions and focuse on the various aspects of advances in software engineering and its Application, disaster recovery and business continuity, education and learning.	Kim, Tai-hoon and Adeli, Hojjat and Kim, Haeng-kon and Kang, Heau-jo and Kim, Kyung Jung and Kiumi, Akingbehin and Kang, Byeong-Ho	kim2011software	NA	NA	NA	NA	NA	NA	NA	NA	book	2011	Springer Science \& Business Media	NA	Software Engineering, Business Continuity, and Education: International Conferences, ASEA, DRBC and EL 2011, Held as Part of the Future Generation Information Technology Conference, FGIT 2011, in Conjunction with GDC 2011, Jeju Island, Korea, December 8-10, 2011. Proceedings	NA	257
[4, 6, 33]	['']	NA	Publication	NA	True	1	0	NA	PublicationSource.PUBLICATION_SEARCH_SNIPPET	/citations?hl=en&xsrf=&continue=/scholar%3Fq%3D5.1.%2BMeasurement%2BNeeds%2BTools%26hl%3Den%26as_sdt%3D0,5&citilm=1&update_op=library_add&info=0dijPgfZEaYJ&ei=6V_wZaf6AtGcy9YP4-WF0A8&json=	/scholar?q=related:0dijPgfZEaYJ:scholar.google.com/&scioq=5.1.+Measurement+Needs+Tools&hl=en&as_sdt=0,5	/scholar?hl=en&q=info:0dijPgfZEaYJ:scholar.google.com/&output=cite&scirp=0&hl=en		Pasteur, Louis	pasteur5	NA	NA	NA	NA	NA	NA	NA	NA	article	NA	Springer	NA	5.1. Measurement Needs Tools	NA	NA
[4, 6, 31, 33]	['8fPEWLgAAAAJ', 'U2KbjvEAAAAJ', 'PV4V4iMAAAAJ']	/scholar?cites=12436163280463790883&as_sdt=2005&sciodt=0,5&hl=en	Publication	https://authors.library.caltech.edu/17597/1/Konca2010p7133B_Seismol_Soc_Am.pdf	True	1	93	https://pubs.geoscienceworld.org/ssa/bssa/article-abstract/100/1/267/349393	PublicationSource.PUBLICATION_SEARCH_SNIPPET	/citations?hl=en&xsrf=&continue=/scholar%3Fq%3D7.1.%2BThe%2BImportance%2Bof%2BEstimation%26hl%3Den%26as_sdt%3D0,5&citilm=1&update_op=library_add&info=IwPNLJ0glqwJ&ei=IXfcZZi_IcCOy9YPlbSLgAg&json=	/scholar?q=related:IwPNLJ0glqwJ:scholar.google.com/&scioq=7.1.+The+Importance+of+Estimation&hl=en&as_sdt=0,5	/scholar?hl=en&q=info:IwPNLJ0glqwJ:scholar.google.com/&output=cite&scirp=0&hl=en	We analyze the rupture process of the 1999 M w 7.1 Duzce earthquake using seismological,  remote sensing, and geodetic data. Ground deformation measured from the subpixel cross	Konca, A Ozgun and Leprince, Sebastien and Avouac, Jean-Philippe and Helmberger, Don V	konca2010rupture	NA	NA	Bulletin of the Seismological Society of America	NA	NA	1	NA	267--288	article	2010	Seismological Society of America	NA	Rupture process of the 1999 M W 7.1 Duzce earthquake from joint analysis of SPOT, GPS, InSAR, strong-motion, and teleseismic data: a supershear rupture with variable rupture velocity	Bulletin of the …	100
[4, 5, 6, 31, 33]	['BClNO4sAAAAJ', 'UoRyg6gAAAAJ']	/scholar?cites=13514016301756068403&as_sdt=2005&sciodt=0,5&hl=en	Publication	https://www.sciencedirect.com/science/article/pii/S131915781831317X	True	1	22	https://www.sciencedirect.com/science/article/pii/S131915781831317X	PublicationSource.PUBLICATION_SEARCH_SNIPPET	/citations?hl=en&xsrf=&continue=/scholar%3Fq%3DA%2BCOSMIC%2Bfunction%2Bpoints%2Bbased%2Btest%2Beffort%2Bestimation%2Bmodel%2Bfor%2Bmobile%2Bapplications%26hl%3Den%26as_sdt%3D0,5&citilm=1&update_op=library_add&info=MzIC4zlui7sJ&ei=lnPcZZeZO9vWy9YP6f6YsAI&json=	/scholar?q=related:MzIC4zlui7sJ:scholar.google.com/&scioq=A+COSMIC+function+points+based+test+effort+estimation+model+for+mobile+applications&hl=en&as_sdt=0,5	/scholar?hl=en&q=info:MzIC4zlui7sJ:scholar.google.com/&output=cite&scirp=0&hl=en	With the substantial proliferation in demand for applications running on mobile devices, developers and testers are foreseen to release applications with high caliber, on time and inside budget. Mobile application testing is imperative and perilous activity in the application development lifecycle, which confirms quality and unswervingly impacts the development effort and affluence of the application. The estimation of effort for testing of apps is a key figure that helps test managers in making approximate accurate decisions for coordinating	Kaur, Anureet and Kaur, Kulwant	kaur2022cosmic	NA	NA	Journal of King Saud University-Computer and Information Sciences	NA	NA	3	NA	946--963	article	2022	Elsevier	NA	A COSMIC function points based test effort estimation model for mobile applications	Journal of King Saud University-Computer and …	34
[4, 5, 6, 31, 33]	['otmdDLoAAAAJ', 'Xo2EwKQAAAAJ', '']	/scholar?cites=4367675188507062164&as_sdt=2005&sciodt=0,5&hl=en	Publication	https://faculty.washington.edu/ajko/papers/Ko2014News.pdf	True	1	16	https://dl.acm.org/doi/abs/10.1145/2593702.2593719	PublicationSource.PUBLICATION_SEARCH_SNIPPET	/citations?hl=en&xsrf=&continue=/scholar%3Fq%3DSoftware%2BMeasurement%2BNews%26hl%3Den%26as_sdt%3D0,5&citilm=1&update_op=library_add&info=lC9AaXEZnTwJ&ei=_XbcZZreEYO26rQP3dyg0AE&json=	/scholar?q=related:lC9AaXEZnTwJ:scholar.google.com/&scioq=Software+Measurement+News&hl=en&as_sdt=0,5	/scholar?hl=en&q=info:lC9AaXEZnTwJ:scholar.google.com/&output=cite&scirp=0&hl=en	of 386,381 news articles, pulled from news sources both large and small in circulation. We  explore a broad notion of software  Our measurement therefore says little about the cumulative	Ko, Amy J and Dosono, Bryan and Duriseti, Neeraja	ko2014thirty	Proceedings of the 7th International Workshop on Cooperative and Human Aspects of Software Engineering	NA	NA	NA	NA	NA	NA	32--39	inproceedings	2014	NA	NA	Thirty years of software problems in the news	… and Human Aspects of Software …	NA
[6, 33]	['4HISXCgAAAAJ', 's6ofriEAAAAJ', 'XOvoWpgAAAAJ']	/scholar?cites=13157750756674392443&as_sdt=2005&sciodt=0,5&hl=en	Publication	http://www.jatit.org/volumes/Vol63No1/9Vol63No1.pdf	True	1	4	http://www.jatit.org/volumes/Vol63No1/9Vol63No1.pdf	PublicationSource.PUBLICATION_SEARCH_SNIPPET	/citations?hl=en&xsrf=&continue=/scholar%3Fq%3DA%2BREFERENCE%2BMODEL%2BOF%2BSECURITY%2BREQUIREMENTS%2BFOR%2BEARLY%2BIDENTIFICATION%2BAND%2BMEASUREMENT%2BOF%2BSECURITY%2BAWARENESS%2BPROGRAM.%26hl%3Den%26as_sdt%3D0,5&citilm=1&update_op=library_add&info=e1G0tpm4mbYJ&ei=Xl_wZajxJNOvy9YPsYKm6A4&json=	/scholar?q=related:e1G0tpm4mbYJ:scholar.google.com/&scioq=A+REFERENCE+MODEL+OF+SECURITY+REQUIREMENTS+FOR+EARLY+IDENTIFICATION+AND+MEASUREMENT+OF+SECURITY+AWARENESS+PROGRAM.&hl=en&as_sdt=0,5	/scholar?hl=en&q=info:e1G0tpm4mbYJ:scholar.google.com/&output=cite&scirp=0&hl=en	In practice, at software/system requirements assembly stages, the focus is regularly on the software security requirements as usually described at the system level this may lead to explicit security-related product which may be implemented as both in system and software. According to the ECSS standards internal security awareness is restricted to avoid illegal access to the software system and confidential data while the external security requirements related awareness is failing to put off the leak of secure output data awareness and illegal	Maqousi, Ali and Balikhina, Tatiana and Meridji, Kenza and Al-Sarayreh, Khalid T	maqousi2014reference	NA	NA	Journal of Theoretical \& Applied Information Technology	NA	NA	1	NA	NA	article	2014	NA	NA	A REFERENCE MODEL OF SECURITY REQUIREMENTS FOR EARLY IDENTIFICATION AND MEASUREMENT OF SECURITY AWARENESS PROGRAM.	Journal of Theoretical & …	63
[4, 5, 6, 7, 8, 9, 33, 34]	['w02r67UvCZcC', '']	/scholar?cites=1158700060590956171&as_sdt=2005&sciodt=0,5&hl=en	Publication	http://ir-library.mmust.ac.ke:8080/xmlui/bitstream/handle/123456789/1393/Munialo-THESIS.pdf?sequence=1&isAllowed=y	True	1	1	http://ir-library.mmust.ac.ke:8080/handle/123456789/1393	PublicationSource.PUBLICATION_SEARCH_SNIPPET	/citations?hl=en&xsrf=&continue=/scholar%3Fq%3DA%2BSIZE%2BMETRIC-BASED%2BEFFORT%2BESTIMATION%2BMETHOD%2BFOR%2BSERVICE%2BORIENTED%2BARCHITECTURE%2BSYSTEMS%26hl%3Den%26as_sdt%3D0,5&citilm=1&update_op=library_add&info=i16_6JCHFBAJ&ei=PFrwZbybH7-46rQP7ZK8qAg&json=	/scholar?q=related:i16_6JCHFBAJ:scholar.google.com/&scioq=A+SIZE+METRIC-BASED+EFFORT+ESTIMATION+METHOD+FOR+SERVICE+ORIENTED+ARCHITECTURE+SYSTEMS&hl=en&as_sdt=0,5	/scholar?hl=en&q=info:i16_6JCHFBAJ:scholar.google.com/&output=cite&scirp=0&hl=en	Service Oriented Architecture (SOA) is one of the recent software development paradigms that enablealignment of business processes into integrated services within and outside organizationsregardless of the heterogeneity of technologies used. Determining the scope, effort and cost of SOA systems is important to facilitate theplanning and eventuallysuccessful implementation of software projects. A number of methodshave been proposedto estimate effort of building SOA projects. Despite the fact that these methods are promising, the	MUNIALO, SAMSON WANJALA and WANJALA, SAMSON	munialo2020size	NA	NA	NA	NA	NA	NA	NA	NA	phdthesis	2020	NA	MMUST	A SIZE METRIC-BASED EFFORT ESTIMATION METHOD FOR SERVICE ORIENTED ARCHITECTURE SYSTEMS	NA	NA
[4, 6, 31, 33]	['1y7Y7YcAAAAJ', '']	NA	Publication	https://www.researchgate.net/profile/Zainab-Hussain/publication/315804372_A_Software_Code_Measures_Based_on_Requirements_Engineering_Documents/links/65460af4ce88b87031c2f4df/A-Software-Code-Measures-Based-on-Requirements-Engineering-Documents.pdf	True	1	0	https://www.researchgate.net/profile/Zainab-Hussain/publication/315804372_A_Software_Code_Measures_Based_on_Requirements_Engineering_Documents/links/65460af4ce88b87031c2f4df/A-Software-Code-Measures-Based-on-Requirements-Engineering-Documents.pdf	PublicationSource.PUBLICATION_SEARCH_SNIPPET	/citations?hl=en&xsrf=&continue=/scholar%3Fq%3DA%2BSoftware%2BCode%2BMeasures%2BBased%2Bon%2BRequirement%2BEngineering%2BDocuments%26hl%3Den%26as_sdt%3D0,5&citilm=1&update_op=library_add&info=eip318mD_eoJ&ei=E3XcZY_xLcCOy9YPlbSLgAg&json=	/scholar?q=related:eip318mD_eoJ:scholar.google.com/&scioq=A+Software+Code+Measures+Based+on+Requirement+Engineering+Documents&hl=en&as_sdt=0,5	/scholar?hl=en&q=info:eip318mD_eoJ:scholar.google.com/&output=cite&scirp=0&hl=en	Research shows that Metrics are used by the software industry to estimate the software before creating it to impact the quality of the decision making earlier at the requirement stage, quantify the development, operation, and maintenance of the software. In this paper a software code measures could be anticipated by the requirement measures gathered from the requirement engineering documents. Ten case studies have been analyzed, datadriven approach have been used to propose two mathematical models, one for requirement metrics	Hussein, Zainab Mohammed and Mohammed, Dahlia Jasim	husseinsoftware	NA	NA	NA	NA	NA	NA	NA	NA	article	NA	NA	NA	A Software Code Measures Based on Requirement Engineering Documents	NA	NA
[4, 5, 6, 33]	['', 'OMIFjfEAAAAJ', '']	/scholar?cites=12316885255427254917&as_sdt=40000005&sciodt=0,22&hl=en	Publication	https://cibse2020.ppgia.pucpr.br/images/artigos/6/S06_P2.pdf	True	1	3	https://cibse2020.ppgia.pucpr.br/images/artigos/6/S06_P2.pdf	PublicationSource.PUBLICATION_SEARCH_SNIPPET	/citations?hl=en&xsrf=&continue=/scholar%3Fq%3DA%2Bcomparative%2Bstudy%2Bon%2Bmeasuring%2Bsoftware%2Bfunctional%2Bsize%2Bto%2Bsupport%2Beffort%2Bestimation%2Bin%2Bagile.%26hl%3Den%26as_sdt%3D0,22&citilm=1&update_op=library_add&info=her81OFd7qoJ&ei=NFrwZfCHDrfHy9YPzam-kA8&json=	/scholar?q=related:her81OFd7qoJ:scholar.google.com/&scioq=A+comparative+study+on+measuring+software+functional+size+to+support+effort+estimation+in+agile.&hl=en&as_sdt=0,22	/scholar?hl=en&q=info:her81OFd7qoJ:scholar.google.com/&output=cite&scirp=0&hl=en	Software effort estimation models based on functional size allow software organizations to plan their development projects. A large number of organizations have adopted agile processes, but there is little evidence on the adoption of functional sizing methods to support software effort estimation in agile contexts. In this study, we compare four functional size estimation methods as the basis for effort estimation in the context of a startup company that develops mobile applications using an agile methodology. Measurements of software size	Ugalde, Fabi{\'a}n and Quesada-L{\'o}pez, Christian and Mart{\'\i}nez, Alexandra and Jenkins, Marcelo	ugalde2020comparative	CIbSE	NA	NA	NA	NA	NA	NA	208--221	inproceedings	2020	NA	NA	A comparative study on measuring software functional size to support effort estimation in agile.	CIbSE	NA
[1, 2, 4, 5, 10, 11, 32, 33, 35]	['UlF-3osAAAAJ', '', 'ERnCTs0AAAAJ']	/scholar?cites=11783889402582412989&as_sdt=2005&sciodt=0,5&hl=en	Publication	https://www.academia.edu/download/48860683/paper-japowsang-camera-ready-v2.pdf	True	1	9	https://ieeexplore.ieee.org/abstract/document/6693232/	PublicationSource.PUBLICATION_SEARCH_SNIPPET	/citations?hl=en&xsrf=&continue=/scholar%3Fq%3DA%2Bconversion%2Bmodel%2Band%2Ba%2Btool%2Bto%2Bidentify%2Bfunction%2Bpoint%2Blogic%2Bfiles%2Busing%2BUML%2Banalysis%2Bclass%2Bdiagrams%26hl%3Den%26as_sdt%3D0,5&citilm=1&update_op=library_add&info=vS5qWfrIiKMJ&ei=Wl_wZZvqAc-Z6rQPzOugyAk&json=	/scholar?q=related:vS5qWfrIiKMJ:scholar.google.com/&scioq=A+conversion+model+and+a+tool+to+identify+function+point+logic+files+using+UML+analysis+class+diagrams&hl=en&as_sdt=0,5	/scholar?hl=en&q=info:vS5qWfrIiKMJ:scholar.google.com/&output=cite&scirp=0&hl=en	Many Function Point (FP) technique adaptations have been proposed to estimate object-oriented software development projects. However, most research works propose rules to identify FP according previous versions of the FP Counting Practices Manual or they do not include some important UML specifications such as the composition relationship between classes. In this paper, we present the rules to identify logic files using analysis class diagrams that are included in the UML2FP technique that we have defined, and a software	Pow-Sang, Jos{\'e} Antonio and Villanueva, Daniela and Flores, Luis and Rusu, Cristian	pow2013conversion	2013 Joint Conference of the 23rd International Workshop on Software Measurement and the 8th International Conference on Software Process and Product Measurement	NA	NA	NA	NA	NA	IEEE	126--134	inproceedings	2013	NA	NA	A conversion model and a tool to identify function point logic files using UML analysis class diagrams	2013 Joint Conference …	NA
[4, 5, 6, 33]	['Ws4x-QwAAAAJ', '2KWZh2cAAAAJ']	/scholar?cites=11753168270267606107&as_sdt=2005&sciodt=0,5&hl=en	Publication	https://www.academia.edu/download/47615503/A_DETAILED_ANALYSIS_OF_SOFTWARE_COST_EST20160729-20370-zqp02c.pdf	True	1	7	https://www.academia.edu/download/47615503/A_DETAILED_ANALYSIS_OF_SOFTWARE_COST_EST20160729-20370-zqp02c.pdf	PublicationSource.PUBLICATION_SEARCH_SNIPPET	/citations?hl=en&xsrf=&continue=/scholar%3Fq%3DA%2Bdetailed%2Banalysis%2Bof%2Bsoftware%2Bcost%2Bestimation%2Busing%2BCOSMIC-FFP%26hl%3Den%26as_sdt%3D0,5&citilm=1&update_op=library_add&info=W2SxVkWkG6MJ&ei=Z1rwZfPlLKms6rQPkO-loAI&json=	/scholar?q=related:W2SxVkWkG6MJ:scholar.google.com/&scioq=A+detailed+analysis+of+software+cost+estimation+using+COSMIC-FFP&hl=en&as_sdt=0,5	/scholar?hl=en&q=info:W2SxVkWkG6MJ:scholar.google.com/&output=cite&scirp=0&hl=en	Software cost estimation is one of the most challenging tasks in software engineering. For the estimation, Function points are useful in the business application software domain and problematic in the real-time software domain. Full Function Points (FFP) are useful for functionality-based estimation, specifically for real-time and embedded software. Functional size measurement method that has user view of functional requirements developed by Common Software Measurement International Consortium (COSMIC) called COSMIC-FFP	Kumar, Gaurav and Bhatia, Pradeep Kumar and others	kumar2015detailed	NA	NA	PAK Publishing Group J. Rev Comput. Eng. Res	NA	NA	2	NA	39--46	article	2015	NA	NA	A detailed analysis of software cost estimation using COSMIC-FFP	PAK Publishing Group J. Rev Comput. Eng …	2
