searchStrings	author_id	citedby_url	container_type	eprint_url	filled	gsrank	num_citations	pub_url	source	url_add_sclib	url_related_articles	url_scholarbib	['bib']abstract	['bib']author	['bib']bib_id	['bib']booktitle	['bib']institution	['bib']journal	['bib']month	['bib']note	['bib']number	['bib']organization	['bib']pages	['bib']pub_type	['bib']pub_year	['bib']publisher	['bib']school	['bib']title	['bib']venue	['bib']volume
[4, 6, 33]	['263GDkUAAAAJ']	/scholar?cites=623993249209486692&as_sdt=2005&sciodt=0,5&hl=en	Publication	https://www.scirp.org/html/4-9301916_47998.htm	True	1	2	https://www.scirp.org/html/4-9301916_47998.htm	PublicationSource.PUBLICATION_SEARCH_SNIPPET	/citations?hl=en&xsrf=&continue=/scholar%3Fq%3DFine-Grained%2BWork%2BElement%2BStandardization%2Bfor%2BProject%2BEffort%2BEstimation%26hl%3Den%26as_sdt%3D0,5&citilm=1&update_op=library_add&info=ZI1f2Y3eqAgJ&ei=Tl_wZZzZNtOvy9YPsYKm6A4&json=	/scholar?q=related:ZI1f2Y3eqAgJ:scholar.google.com/&scioq=Fine-Grained+Work+Element+Standardization+for+Project+Effort+Estimation&hl=en&as_sdt=0,5	/scholar?hl=en&q=info:ZI1f2Y3eqAgJ:scholar.google.com/&output=cite&scirp=0&hl=en	Traditional project effort estimation utilizes development models that span the entire project life cycle and thus culminates estimation errors. This exploratory research is the first attempt to break each project activity down to smaller work elements. There are eight work elements, each of which is being defined and symbolized with visually distinct shape. The purpose is to standardize the operations associated with the development process in the form of a visual symbolic flow map. Hence, developers can streamline their work systematically	Sophatsathit, Peraphon	sophatsathit2014fine	NA	NA	Journal of Software Engineering and Applications	NA	NA	NA	NA	NA	article	2014	Scientific Research Publishing	NA	Fine-Grained Work Element Standardization for Project Effort Estimation	Journal of Software Engineering and Applications	2014
[4, 6, 33]	['lAojBUsAAAAJ', 'L-7d2uUAAAAJ', 'J8j_EZ8AAAAJ']	/scholar?cites=5208867310801626998&as_sdt=5,41&sciodt=0,41&hl=en	Publication	NA	True	1	16	https://books.google.com/books?hl=en&lr=&id=-8yGDwAAQBAJ&oi=fnd&pg=PA308&dq=Formal+Method+in+Software+Estimation&ots=5F5tLOxhHr&sig=yVYMKmyi4HBpHNpds4EGL_9u184	PublicationSource.PUBLICATION_SEARCH_SNIPPET	/citations?hl=en&xsrf=&continue=/scholar%3Fq%3DFormal%2BMethod%2Bin%2BSoftware%2BEstimation%26hl%3Den%26as_sdt%3D0,41&citilm=1&update_op=library_add&info=dqd5rjidSUgJ&ei=H1_wZdvpIMfTy9YPt6iP6AU&json=	/scholar?q=related:dqd5rjidSUgJ:scholar.google.com/&scioq=Formal+Method+in+Software+Estimation&hl=en&as_sdt=0,41	/scholar?hl=en&q=info:dqd5rjidSUgJ:scholar.google.com/&output=cite&scirp=0&hl=en	Note that cost estimation for systems where formal methods are employed is relatively more  precise. Research shows that organizations spend 33–50% of their total cost of ownership (	Hinchey, Mike and Bowen, Jonathan P and Vassev, Emil	hinchey2010formal	NA	NA	NA	NA	NA	NA	NA	NA	misc	2010	NA	NA	Formal Methods.	NA	NA
[4, 5, 6, 10, 11, 12, 31, 33, 35]	['MIqxWVsAAAAJ', 'zYKpvl4AAAAJ']	/scholar?cites=1100939568765326740&as_sdt=5,33&sciodt=0,33&hl=en	Publication	NA	True	1	5	https://www.igi-global.com/chapter/modern-software-engineering-concepts-practices/51975	PublicationSource.PUBLICATION_SEARCH_SNIPPET	/citations?hl=en&xsrf=&continue=/scholar%3Fq%3DFormalization%2Bstudies%2Bin%2Bfunctional%2Bsize%2Bmeasurement%26hl%3Den%26as_sdt%3D0,33&citilm=1&update_op=library_add&info=lNVta7RSRw8J&ei=OHXcZYSrA5iCy9YPqICOgAg&json=	/scholar?q=related:lNVta7RSRw8J:scholar.google.com/&scioq=Formalization+studies+in+functional+size+measurement&hl=en&as_sdt=0,33	/scholar?hl=en&q=info:lNVta7RSRw8J:scholar.google.com/&output=cite&scirp=0&hl=en	Functional size has been favored as a software size attribute that can be measured early in the software development cycles. Its characteristics of being independent of implementation language, technique and technology promoted the use in software cost estimation and other project management practices. It has been about three decades since Albrecht introduced the concept of functional size and a variety of measurement methods have been developed, some of which have been published by International Organization for Standardization (ISO)	{\"O}zkan, Baris and Demir{\"o}rs, Onur	ozkan2011formalization	NA	NA	Modern Software Engineering Concepts and Practices: Advanced Approaches	NA	NA	NA	NA	242--262	article	2011	IGI Global	NA	Formalization studies in functional size measurement	Modern Software Engineering Concepts and …	NA
[4, 5, 6, 10, 11, 12, 31, 33, 35]	['MIqxWVsAAAAJ', 'zYKpvl4AAAAJ']	/scholar?cites=8160185416970325928&as_sdt=2005&sciodt=0,5&hl=en	Publication	https://www.academia.edu/download/75364667/Formalization_Studies_in_Functional_Size20211129-14157-1l5pvqw.pdf	True	1	2	https://link.springer.com/chapter/10.1007/978-3-642-05415-0_15	PublicationSource.PUBLICATION_SEARCH_SNIPPET	/citations?hl=en&xsrf=&continue=/scholar%3Fq%3DFormalization%2Bstudies%2Bin%2Bfunctional%2Bsize%2Bmeasurement:%2Bhow%2Bdo%2Bthey%2Bhelp%253F%26hl%3Den%26as_sdt%3D0,5&citilm=1&update_op=library_add&info=qM_W92bNPnEJ&ei=TlrwZcyPNZfHy9YPrZeb0Aw&json=	/scholar?q=related:qM_W92bNPnEJ:scholar.google.com/&scioq=Formalization+studies+in+functional+size+measurement:+how+do+they+help%3F&hl=en&as_sdt=0,5	/scholar?hl=en&q=info:qM_W92bNPnEJ:scholar.google.com/&output=cite&scirp=0&hl=en	Functional size has been favored as a software characteristic that can be measured early and independent of language, tools, techniques and technology; hence has many uses in software project management. It has been about three decades since Albrecht introduced the concept of functional size. However, Functional Size Measurement (FSM) has not been a common practice in the software community. The problems with FSM method structures and practices have been discussed to be the major factors to explain this situation. In this paper	Ozkan, Baris and Demirors, Onur	ozkan2009formalization	Software Process and Product Measurement: International Conferences IWSM 2009 and Mensura 2009 Amsterdam, The Netherlands, November 4-6, 2009. Proceedings	NA	NA	NA	NA	NA	Springer	197--211	inproceedings	2009	NA	NA	Formalization studies in functional size measurement: how do they help?	… Conferences IWSM 2009 and Mensura 2009 …	NA
[6, 21, 31, 33, 38]	['', 'dpfL0e0AAAAJ']	/scholar?cites=6496150746532519711&as_sdt=2005&sciodt=0,5&hl=en	Publication	https://pdfs.semanticscholar.org/058a/6aa647274914071bdc9b0ecdfd4a41e5efe9.pdf	True	1	6	https://pdfs.semanticscholar.org/058a/6aa647274914071bdc9b0ecdfd4a41e5efe9.pdf	PublicationSource.PUBLICATION_SEARCH_SNIPPET	/citations?hl=en&xsrf=&continue=/scholar%3Fq%3DFrom%2Brequirements%2Bto%2Bproject%2Beffort%2Bestimates%25E2%2580%2593work%2Bin%2Bprogress%2B(still%253F)%26hl%3Den%26as_sdt%3D0,5&citilm=1&update_op=library_add&info=H591lq_2JloJ&ei=fXXcZZHRONvWy9YP6f6YsAI&json=	/scholar?q=related:H591lq_2JloJ:scholar.google.com/&scioq=From+requirements+to+project+effort+estimates%E2%80%93work+in+progress+(still%3F)&hl=en&as_sdt=0,5	/scholar?hl=en&q=info:H591lq_2JloJ:scholar.google.com/&output=cite&scirp=0&hl=en	• Estimating: the issues • How can we improve the early estimation of project effort from  requirements?  • How can we improve the early estimation of project effort from requirements?	Symons, Charles and Gencel, Cigdem	symons2013requirements	REFSQ Conference, Essen, Germany	NA	NA	NA	NA	NA	NA	NA	inproceedings	2013	NA	NA	From requirements to project effort estimates--work in progress (still?)	REFSQ Conference, Essen …	NA
[4, 6, 31, 33]	['', '']	/scholar?cites=138002281198572677&as_sdt=2005&sciodt=0,5&hl=en	Publication	https://www.researchgate.net/profile/Thomas-Fehlmann/publication/266440968_From_Story_Points_to_COSMIC_Function_Points_From_Story_Points_to_COSMIC_Function_Points_in_Agile_Software_Development_-_A_Six_Sigma_perspective/links/551298600cf20bfdad518d96/From-Story-Points-to-COSMIC-Function-Points-From-Story-Points-to-COSMIC-Function-Points-in-Agile-Software-Development-A-Six-Sigma-perspective.pdf	True	1	16	https://www.researchgate.net/profile/Thomas-Fehlmann/publication/266440968_From_Story_Points_to_COSMIC_Function_Points_From_Story_Points_to_COSMIC_Function_Points_in_Agile_Software_Development_-_A_Six_Sigma_perspective/links/551298600cf20bfdad518d96/From-Story-Points-to-COSMIC-Function-Points-From-Story-Points-to-COSMIC-Function-Points-in-Agile-Software-Development-A-Six-Sigma-perspective.pdf	PublicationSource.PUBLICATION_SEARCH_SNIPPET	/citations?hl=en&xsrf=&continue=/scholar%3Fq%3DFrom%2Bstory%2Bpoints%2Bto%2Bcosmic%2Bfunction%2Bpoints%2Bin%2Bagile%2Bsoftware%2Bdevelopment%25E2%2580%2593a%2Bsix%2Bsigma%2Bperspective%26hl%3Den%26as_sdt%3D0,5&citilm=1&update_op=library_add&info=hdQI9VdI6gEJ&ei=nHTcZYPdCrDDy9YPzfW0sAI&json=	/scholar?q=related:hdQI9VdI6gEJ:scholar.google.com/&scioq=From+story+points+to+cosmic+function+points+in+agile+software+development%E2%80%93a+six+sigma+perspective&hl=en&as_sdt=0,5	/scholar?hl=en&q=info:hdQI9VdI6gEJ:scholar.google.com/&output=cite&scirp=0&hl=en	The spreading of agile methodologies in software development raises the question of how to measure requirements once more, as it happened in 'traditional'software industry development approaches decades ago. The difference is that requirements are not known in advance but detected as User Stories while iterating and enhancing the software product from one agile 'Sprint'to the other. Some authors–promoting best practices for agile software development–propose Story Points to size User Stories (eg, Scrum, with Story Cards), yet	Fehlmann, Thomas and Santillo, Luca	fehlmann2010story	Metrikon-Software Metrik Kongress	NA	NA	NA	NA	NA	NA	24	inproceedings	2010	NA	NA	From story points to cosmic function points in agile software development--a six sigma perspective	Metrikon-Software Metrik Kongress	NA
[1, 2, 3, 4, 5, 6, 10, 11, 12, 32, 33, 35]	['37O-IJgAAAAJ', 'vtwyhcAAAAAJ']	/scholar?cites=10742873974296766138&as_sdt=2005&sciodt=0,5&hl=en	Publication	https://www.researchgate.net/profile/R-Jeffery-2/publication/3187191_Function_Points_in_the_Estimation_and_Evaluation_of_the_Software_Process/links/0c96053228620b2a93000000/Function-Points-in-the-Estimation-and-Evaluation-of-the-Software-Process.pdf	True	1	366	https://ieeexplore.ieee.org/abstract/document/44364/	PublicationSource.PUBLICATION_SEARCH_SNIPPET	/citations?hl=en&xsrf=&continue=/scholar%3Fq%3DFunction%2Bpoints%26hl%3Den%26as_sdt%3D0,5&citilm=1&update_op=library_add&info=uma_IPZaFpUJ&ei=iFrwZeX4A6ms6rQPkO-loAI&json=	/scholar?q=related:uma_IPZaFpUJ:scholar.google.com/&scioq=Function+points&hl=en&as_sdt=0,5	/scholar?hl=en&q=info:uma_IPZaFpUJ:scholar.google.com/&output=cite&scirp=0&hl=en	function points. This paper reports the results of an empirical research project into the  consistency and limitations of function points  The paper concludes that function points are a more	Low, Graham C. and Jeffery, D. Ross	low1990function	NA	NA	IEEE transactions on Software Engineering	NA	NA	1	NA	64--71	article	1990	IEEE	NA	Function points in the estimation and evaluation of the software process	IEEE transactions on Software …	16
[4, 5, 6, 31, 33]	['81M-rsEAAAAJ']	/scholar?cites=28723900650038570&as_sdt=2005&sciodt=0,5&hl=en	Publication	NA	True	1	20	https://www.sciencedirect.com/science/article/pii/S0950584916301380	PublicationSource.PUBLICATION_SEARCH_SNIPPET	/citations?hl=en&xsrf=&continue=/scholar%3Fq%3DFunctional%2Bsize%2Bapproximation%2Bbased%2Bon%2Buse-case%2Bnames%26hl%3Den%26as_sdt%3D0,5&citilm=1&update_op=library_add&info=KiXPRjwMZgAJ&ei=lHTcZbSADLDDy9YPzfW0sAI&json=	/scholar?q=related:KiXPRjwMZgAJ:scholar.google.com/&scioq=Functional+size+approximation+based+on+use-case+names&hl=en&as_sdt=0,5	/scholar?hl=en&q=info:KiXPRjwMZgAJ:scholar.google.com/&output=cite&scirp=0&hl=en	Context: Functional size measures, such as IFPUG Function Points or COSMIC, are widely used to support software development effort estimation. Unfortunately, applying the COSMIC or IFPUG Function Point Analysis methods at early stages of software development is difficult or even impossible because available functional requirements are imprecise. Moreover, the resources that could be allocated to perform such measurement are usually limited. Therefore, it is worth investigating the possibility of automating the approximation of	Ochodek, Miros{\l}aw	ochodek2016functional	NA	NA	Information and Software Technology	NA	NA	NA	NA	73--88	article	2016	Elsevier	NA	Functional size approximation based on use-case names	Information and Software Technology	80
[4, 5, 6, 31, 33]	['PCU9bnUAAAAJ', '', 'XAboVjwAAAAJ', 'vxWlys4AAAAJ', 'JcyHeLYAAAAJ']	NA	Publication	https://www.researchgate.net/profile/Donatien-Koulla-Moulla/publication/375551430_Functional_Size_Measurement_for_X86_Assembly_Programs/links/654e624c3fa26f66f4ed2c7f/Functional-Size-Measurement-for-X86-Assembly-Programs.pdf	True	1	0	https://www.researchgate.net/profile/Donatien-Koulla-Moulla/publication/375551430_Functional_Size_Measurement_for_X86_Assembly_Programs/links/654e624c3fa26f66f4ed2c7f/Functional-Size-Measurement-for-X86-Assembly-Programs.pdf	PublicationSource.PUBLICATION_SEARCH_SNIPPET	/citations?hl=en&xsrf=&continue=/scholar%3Fq%3DFunctional%2Bsize%2Bmeasurement%2Bfor%2BX86%2Bassembly%2Bprograms%26hl%3Den%26as_sdt%3D0,5&citilm=1&update_op=library_add&info=vFofiI_mBWMJ&ei=hm26Zae-FtLFy9YPoL6q0AE&json=	NA	/scholar?hl=en&q=info:vFofiI_mBWMJ:scholar.google.com/&output=cite&scirp=0&hl=en	Functional size measurement (FSM) provides a reliable and objective way to measure productivity and estimate the effort required for software activities. FSM automation, compared to manual measurement, enables to reduce errors, increase consistency, and improve the efficiency of the measurement process. This paper presents a COSMIC-based automated FSM for X86 assembly programs widely used in personal computers and servers. The proposed approach applies the COSMIC-ISO 19761 rules for sizing Functional User	Moulla, Donatien Koulla and Kitikil, Abdel Aziz and Mnkandla, Ernest and Soubra, Hassan and Abran, Alain	moulla2023functional	NA	NA	NA	NA	NA	NA	NA	NA	article	2023	CEUR-WS	NA	Functional size measurement for X86 assembly programs	NA	NA
[3, 6, 32, 33]	['AW50mYoAAAAJ']	/scholar?cites=17303186058900024754&as_sdt=2005&sciodt=0,5&hl=en	Publication	https://citeseerx.ist.psu.edu/document?repid=rep1&type=pdf&doi=3612b162a7e2f9e9484e5f9b7c5b45d076485556	True	1	28	https://link.springer.com/chapter/10.1007/978-3-540-45242-3_36	PublicationSource.PUBLICATION_SEARCH_SNIPPET	/citations?hl=en&xsrf=&continue=/scholar%3Fq%3DFunctional%2Bsize%2Bmeasurement%2Bof%2Bmulti-layer%2Bobject-oriented%2Bconceptual%2Bmodels%26hl%3Den%26as_sdt%3D0,5&citilm=1&update_op=library_add&info=si06WwtEIfAJ&ei=WVrwZa2NGLfHy9YPzam-kA8&json=	/scholar?q=related:si06WwtEIfAJ:scholar.google.com/&scioq=Functional+size+measurement+of+multi-layer+object-oriented+conceptual+models&hl=en&as_sdt=0,5	/scholar?hl=en&q=info:si06WwtEIfAJ:scholar.google.com/&output=cite&scirp=0&hl=en	This paper builds on previous work showing a way to map the concepts used in object-oriented business domain modelling onto (a subset of) the concepts used by the COSMIC Full Function Points (COSMIC-FFP) functional size measurement method for modelling and sizing a software system from the point of view of its functional user requirements. In this paper we present a refined set of measurement rules resulting from a careful revision of our previous proposal, based on 'field trials' and feedback from function points experts. The main	Poels, Geert	poels2003functional	International Conference on Object-Oriented Information Systems	NA	NA	NA	NA	NA	Springer	334--345	inproceedings	2003	NA	NA	Functional size measurement of multi-layer object-oriented conceptual models	… Conference on Object-Oriented Information Systems	NA
[4, 6, 19, 21, 31, 33, 38]	['GoXiawsAAAAJ', 'X1GJ1oYAAAAJ']	/scholar?cites=10127137009290884818&as_sdt=2005&sciodt=0,5&hl=en	Publication	NA	True	1	7	https://ieeexplore.ieee.org/abstract/document/7809588/	PublicationSource.PUBLICATION_SEARCH_SNIPPET	/citations?hl=en&xsrf=&continue=/scholar%3Fq%3DFunctional%2Bsize%2Bmeasurement%2Bpatterns:%2BA%2Bproposed%2Bapproach%26hl%3Den%26as_sdt%3D0,5&citilm=1&update_op=library_add&info=0rZ-PnTRiowJ&ei=tXPcZYmLIZSt6rQP7YCU2Aw&json=	/scholar?q=related:0rZ-PnTRiowJ:scholar.google.com/&scioq=Functional+size+measurement+patterns:+A+proposed+approach&hl=en&as_sdt=0,5	/scholar?hl=en&q=info:0rZ-PnTRiowJ:scholar.google.com/&output=cite&scirp=0&hl=en	This paper introduces the concepts of functional size measurement (FSM) patterns. These FSM patterns apply to the COSMIC FSM method and may help in solving several issues, such as being able to do an early sizing for estimation, helping inexperienced measurers in learning how to apply the COSMIC method by establishing the relationship between the method rules and the measurement results, avoiding measurement errors, and reducing measurement effort. The approach used to define FSM patterns is Design Science	Trudel, Sylvie and Desharnais, Jean-Marc and Cloutier, Jimmy	trudel2016functional	2016 Joint Conference of the International Workshop on Software Measurement and the International Conference on Software Process and Product Measurement (IWSM-MENSURA)	NA	NA	NA	NA	NA	IEEE	23--34	inproceedings	2016	NA	NA	Functional size measurement patterns: A proposed approach	2016 Joint Conference of …	NA
[6, 9, 12, 31, 33, 34, 35]	['lqznsicAAAAJ', 'QOMOtp0AAAAJ', 'sJ_foMcAAAAJ']	/scholar?cites=7298784152785632146&as_sdt=5,33&sciodt=0,33&hl=en	Publication	https://www.sciencedirect.com/science/article/pii/S1319157822003585	True	1	9	https://www.sciencedirect.com/science/article/pii/S1319157822003585	PublicationSource.PUBLICATION_SEARCH_SNIPPET	/citations?hl=en&xsrf=&continue=/scholar%3Fq%3DGenerating%2BBPMN%2Bdiagram%2Bfrom%2Btextual%2Brequirements%26hl%3Den%26as_sdt%3D0,33&citilm=1&update_op=library_add&info=krsJL4R9SmUJ&ei=i3bcZcLtAvXMy9YPpY2Q0A8&json=	/scholar?q=related:krsJL4R9SmUJ:scholar.google.com/&scioq=Generating+BPMN+diagram+from+textual+requirements&hl=en&as_sdt=0,33	/scholar?hl=en&q=info:krsJL4R9SmUJ:scholar.google.com/&output=cite&scirp=0&hl=en	An interesting challenge in software requirements engineering is converting textual requirements to Business Process Model and Notation (BPMN) diagrams. In this study, the BPMN diagram is used as an intermediate representation before measuring the functional software size from Natural Language (NL) input. The methods currently used for converting NL input to BPMN diagrams are not able to generate complete BPMN diagrams, nor can they handle complex and compound-complex sentences in the NL input. This study	Sholiq, Sholiq and Sarno, Riyanarto and Astuti, Endang Siti	sholiq2022generating	NA	NA	Journal of King Saud University-Computer and Information Sciences	NA	NA	10	NA	10079--10093	article	2022	Elsevier	NA	Generating BPMN diagram from textual requirements	Journal of King Saud University-Computer …	34
[4, 6, 33]	['', 'WVSSGJkAAAAJ', 'mnea_g8AAAAJ']	/scholar?cites=15556134364379417924&as_sdt=2005&sciodt=0,5&hl=en	Publication	https://ieeexplore.ieee.org/iel7/6287639/6514899/09481255.pdf	True	1	7	https://ieeexplore.ieee.org/abstract/document/9481255/	PublicationSource.PUBLICATION_SEARCH_SNIPPET	/citations?hl=en&xsrf=&continue=/scholar%3Fq%3DRole%2Bof%2Bcritical%2Bsuccess%2Bfactors%2Bin%2Boffshore%2Bquality%2Brequirement%2Bchange%2Bmanagement%2Busing%2BSLR%26hl%3Den%26as_sdt%3D0,5&citilm=1&update_op=library_add&info=RA0V08h94tcJ&ei=hmDwZeapDNGcy9YP4-WF0A8&json=	/scholar?q=related:RA0V08h94tcJ:scholar.google.com/&scioq=Role+of+critical+success+factors+in+offshore+quality+requirement+change+management+using+SLR&hl=en&as_sdt=0,5	/scholar?hl=en&q=info:RA0V08h94tcJ:scholar.google.com/&output=cite&scirp=0&hl=en	In software engineering field, requirement change management is a challenging job. Ignoring incoming changes results in customer displeasure. It may also result in late product transportation. Managing requirement changes in poor way is the main cause of product failure. It has more diverse effect in global software outsourcing. In software quality requirement change management, it is necessary to address success factors in order to accomplish the requirements of the customers. In this paper, systematic literature review	Ahmad, Jamshed and Khan, Abdul Wahid and Khan, Habib Ullah	ahmad2021role	NA	NA	IEEE Access	NA	NA	NA	NA	99680--99698	article	2021	IEEE	NA	Role of critical success factors in offshore quality requirement change management using SLR	IEEE Access	9
[4, 5, 6, 33]	['NGeKzUsAAAAJ', '']	NA	Publication	https://portalrevistas.ucb.br/index.php/RGCTI/article/view/7824/4994	True	1	0	https://portalrevistas.ucb.br/index.php/RGCTI/article/view/7824	PublicationSource.PUBLICATION_SEARCH_SNIPPET	/citations?hl=en&xsrf=&continue=/scholar%3Fq%3DGuia%2Bde%2Bapoio%2Bde%2Ban%25C3%25A1lise%2Bde%2Bponto%2Bde%2Bfun%25C3%25A7%25C3%25A3o:%2Buma%2Bproposta%2Bpara%2Binterpreta%25C3%25A7%25C3%25A3o%2Bde%2Bprocesso%2Belementar%26hl%3Den%26as_sdt%3D0,5&citilm=1&update_op=library_add&info=lB0PDCw1VEwJ&ei=_cwBZuSuDdio6rQP95mt8Aw&json=	/scholar?q=related:lB0PDCw1VEwJ:scholar.google.com/&scioq=Guia+de+apoio+de+an%C3%A1lise+de+ponto+de+fun%C3%A7%C3%A3o:+uma+proposta+para+interpreta%C3%A7%C3%A3o+de+processo+elementar&hl=en&as_sdt=0,5	/scholar?hl=en&q=info:lB0PDCw1VEwJ:scholar.google.com/&output=cite&scirp=0&hl=en	O governo brasileiro vem contratando serviço de desenvolvimento de software e remunerando os respectivos fornecedores por ponto de função (PF). No entanto, a medição por PF, por depender de interpretação humana, há variação nos resultados da medição. Esta pesquisa objetivou identificar quais outros critérios, além daqueles explicitamente recomendados pelo IFPUG, os especialistas vêm considerando para caracterizar uma “pequena variação” ou não de um processo elementar (PE) e até que ponto estes outros	Pereira, Josiani Neves and Ferneda, Edilson and Campos, Fabio Bianchi	pereira2017guia	NA	NA	Revista Gest{\~a}o do Conhecimento e Tecnologia da Informa{\c{c}}{\~a}o	NA	NA	1	NA	64--87	article	2017	NA	NA	Guia de apoio de an{\'a}lise de ponto de fun{\c{c}}{\~a}o: uma proposta para interpreta{\c{c}}{\~a}o de processo elementar	Revista Gestão do …	1
[4, 5, 6, 33]	['NGeKzUsAAAAJ']	/scholar?cites=10128233791419256472&as_sdt=2005&sciodt=0,5&hl=en	Publication	https://bdtd.ucb.br:8443/jspui/bitstream/123456789/1440/1/Josiani%20Neves%20Pereira.pdf	True	1	1	https://bdtd.ucb.br:8443/jspui/handle/123456789/1440	PublicationSource.PUBLICATION_SEARCH_SNIPPET	/citations?hl=en&xsrf=&continue=/scholar%3Fq%3DGuia%2Bde%2Bapoio%2Bde%2Ban%25C3%25A1lise%2Bpor%2Bponto%2Bde%2Bfun%25C3%25A7%25C3%25A3o:%2Buma%2Bproposta%2Bpreliminar%2Bpara%2Binterpreta%25C3%25A7%25C3%25A3o%2Bde%2Bprocesso%2Belementar%26hl%3Den%26as_sdt%3D0,5&citilm=1&update_op=library_add&info=mA6nu_i2jowJ&ei=CM0BZvu6O5eTy9YPp82Q0AY&json=	/scholar?q=related:mA6nu_i2jowJ:scholar.google.com/&scioq=Guia+de+apoio+de+an%C3%A1lise+por+ponto+de+fun%C3%A7%C3%A3o:+uma+proposta+preliminar+para+interpreta%C3%A7%C3%A3o+de+processo+elementar&hl=en&as_sdt=0,5	/scholar?hl=en&q=info:mA6nu_i2jowJ:scholar.google.com/&output=cite&scirp=0&hl=en	O governo brasileiro vem contratando serviço de desenvolvimento de software e remunerando os respectivos fornecedores por ponto de função (PF). No entanto, a medição por PF, por depender de interpretação humana, há variação nos resultados da medição. Esta pesquisa objetivou identificar quais outros critérios, além daqueles explicitamente recomendados pelo IFPUG, os especialistas vêm considerando para caracterizar uma “pequena variação” ou não de um processo elementar (PE) e até que ponto estes outros	Pereira, Josiani Neves and others	pereira2014guia	NA	NA	NA	NA	NA	NA	NA	NA	article	2014	Universidade Cat{\'o}lica de Bras{\'\i}lia	NA	Guia de apoio de an{\'a}lise por ponto de fun{\c{c}}{\~a}o: uma proposta preliminar para interpreta{\c{c}}{\~a}o de processo elementar	NA	NA
[4, 6, 33]	['', 'MMcFXkEAAAAJ']	/scholar?cites=12582882639715749037&as_sdt=2005&sciodt=0,5&hl=en	Publication	http://ndl.ethernet.edu.et/bitstream/123456789/62685/1/4.pdf	True	1	205	https://link.springer.com/content/pdf/10.1007/b138013.pdf	PublicationSource.PUBLICATION_SEARCH_SNIPPET	/citations?hl=en&xsrf=&continue=/scholar%3Fq%3DChristof%2BEbert%25E2%2580%25A2%2BReiner%2BDumke%26hl%3Den%26as_sdt%3D0,5&citilm=1&update_op=library_add&info=rcyvBhhhn64J&ei=O2DwZembG_aY6rQPvJatqAw&json=	/scholar?q=related:rcyvBhhhn64J:scholar.google.com/&scioq=Christof+Ebert%E2%80%A2+Reiner+Dumke&hl=en&as_sdt=0,5	/scholar?hl=en&q=info:rcyvBhhhn64J:scholar.google.com/&output=cite&scirp=0&hl=en	Ebert lectures at the University of Stuttgart and serves as a keynote speaker and on program  committees of various software engineering conferences. Since the end of 1980s, he has	Bundschuh, Manfred and Schmietendorf, Andreas	bundschuh2005christof	NA	NA	NA	NA	NA	NA	NA	NA	article	2005	Springer	NA	Christof Ebert• Reiner Dumke	NA	NA
