searchStrings	author_id	citedby_url	container_type	eprint_url	filled	gsrank	num_citations	pub_url	source	url_add_sclib	url_related_articles	url_scholarbib	['bib']abstract	['bib']author	['bib']bib_id	['bib']booktitle	['bib']institution	['bib']journal	['bib']month	['bib']note	['bib']number	['bib']organization	['bib']pages	['bib']pub_type	['bib']pub_year	['bib']publisher	['bib']school	['bib']title	['bib']venue	['bib']volume
[4, 5, 6, 33]	['MvT6c8YAAAAJ', '', 'xoesuc8AAAAJ']	/scholar?cites=11620558047739473649&as_sdt=2005&sciodt=0,5&hl=en	Publication	https://www.researchgate.net/profile/Vo-Hai-5/publication/353365474_Empirical_Evidence_in_Early_Stage_Software_Effort_Estimation_Using_Data_Flow_Diagram/links/61b9bc9bfd2cbd7200a04330/Empirical-Evidence-in-Early-Stage-Software-Effort-Estimation-Using-Data-Flow-Diagram.pdf	True	1	1	https://link.springer.com/chapter/10.1007/978-3-030-77442-4_53	PublicationSource.PUBLICATION_SEARCH_SNIPPET	/citations?hl=en&xsrf=&continue=/scholar%3Fq%3DEmpirical%2BEvidence%2Bin%2BEarly%2BStage%2BSoftware%2BEffort%2BEstimation%2BUsing%2BData%2BFlow%2BDiagram%26hl%3Den%26as_sdt%3D0,5&citilm=1&update_op=library_add&info=8W5R3_mDRKEJ&ei=NmDwZcAxt8fL1g_Nqb6QDw&json=	/scholar?q=related:8W5R3_mDRKEJ:scholar.google.com/&scioq=Empirical+Evidence+in+Early+Stage+Software+Effort+Estimation+Using+Data+Flow+Diagram&hl=en&as_sdt=0,5	/scholar?hl=en&q=info:8W5R3_mDRKEJ:scholar.google.com/&output=cite&scirp=0&hl=en	Software effort estimation in a very early stage of the application development lifecycle is always a challenge for project managers. Many researchers have proposed different methods. They have certain advantages and limitations. This study proposed an approach called Early Effort Estimation from the data flow diagram with a complexity tag added that could estimate the effort estimation in a very early stage of the software development cycle. This method can be obtained by evaluating the customized data flow diagram, a data flow	Van Hai, Vo and Le Thi Kim Nhung, Ho and Hoc, Huynh Thai	van2021empirical	Software Engineering and Algorithms: Proceedings of 10th Computer Science On-line Conference 2021, Vol. 1	NA	NA	NA	NA	NA	Springer	632--644	inproceedings	2021	NA	NA	Empirical Evidence in Early Stage Software Effort Estimation Using Data Flow Diagram	… On-line Conference 2021, Vol. 1	NA
[33]	['4npbuV0AAAAJ']	/scholar?cites=3613706227234611873&as_sdt=2005&sciodt=0,5&hl=en	Publication	https://www.researchgate.net/profile/Fabio-Calefato/publication/300443441_Practice_Collaborative_Development_Environments/links/5a198021aca272df080ab197/Practice-Collaborative-Development-Environments.pdf	True	1	104	https://books.google.com/books?hl=en&lr=&id=Bj7poEQLZOUC&oi=fnd&pg=PT11&dq=Global+software+and+IT:+a+guide+to+distributed+development,+projects,+and+outsourcing&ots=l8duJ9f6Ez&sig=X8CrdRod2xAV6rqNJbdobN1el-E	PublicationSource.PUBLICATION_SEARCH_SNIPPET	/citations?hl=en&xsrf=&continue=/scholar%3Fq%3DGlobal%2Bsoftware%2Band%2BIT:%2Ba%2Bguide%2Bto%2Bdistributed%2Bdevelopment,%2Bprojects,%2Band%2Boutsourcing%26hl%3Den%26as_sdt%3D0,5&citilm=1&update_op=library_add&info=oaLv3Kp2JjIJ&ei=bGDwZf7nLtGcy9YP4-WF0A8&json=	/scholar?q=related:oaLv3Kp2JjIJ:scholar.google.com/&scioq=Global+software+and+IT:+a+guide+to+distributed+development,+projects,+and+outsourcing&hl=en&as_sdt=0,5	/scholar?hl=en&q=info:oaLv3Kp2JjIJ:scholar.google.com/&output=cite&scirp=0&hl=en	Based on the author's first-hand experience and expertise, this book offers a proven framework for global software engineering. Readers will learn best practices for managing a variety of software projects, coordinating the activities of several locations across the globe while accounting for cultural differences. Most importantly, readers will learn how to engineer a first-rate software product as efficiently as possible by fully leveraging global personnel and resources. Global Software and IT takes a unique approach that works for	Ebert, Christof	ebert2011global	NA	NA	NA	NA	NA	NA	NA	NA	book	2011	John Wiley \& Sons	NA	Global software and IT: a guide to distributed development, projects, and outsourcing	NA	NA
[4, 5, 33]	['6HTPVXIAAAAJ', '', '']	/scholar?cites=16008895102840218129&as_sdt=2005&sciodt=0,5&hl=en	Publication	https://www.hindawi.com/journals/archive/2011/495232/	True	1	10	https://www.hindawi.com/journals/archive/2011/495232/	PublicationSource.PUBLICATION_SEARCH_SNIPPET	/citations?hl=en&xsrf=&continue=/scholar%3Fq%3DReMoFP:%2Ba%2Btool%2Bfor%2Bcounting%2Bfunction%2Bpoints%2Bfrom%2BUML%2Brequirement%2Bmodels%26hl%3Den%26as_sdt%3D0,5&citilm=1&update_op=library_add&info=ESJI-0YFK94J&ei=b1rwZcuiEdOvy9YPsYKm6A4&json=	/scholar?q=related:ESJI-0YFK94J:scholar.google.com/&scioq=ReMoFP:+a+tool+for+counting+function+points+from+UML+requirement+models&hl=en&as_sdt=0,5	/scholar?hl=en&q=info:ESJI-0YFK94J:scholar.google.com/&output=cite&scirp=0&hl=en	Function Point Analysis (FPA) is a widely used technique for measuring software size. It measures software functionality from the user's perspective, usually based on a requirements description. In many software processes, these requirements are represented by UML models. Although there have been attempts to automate the measurement process, FPA counting requires a considerable amount of interpretation which, to be reliable, should be made by experts. On the other hand, fully manual counting methods usually fail to keep	Batista, Vitor A and Peixoto, Daniela CC and Borges, Eduardo P and P{\'a}dua, Wilson and Resende, Rodolfo F and P{\'a}dua, Clarindo Isa{\'\i}as PS	batista2011remofp	NA	NA	Advances in Software Engineering	NA	NA	NA	NA	NA	article	2011	Hindawi	NA	ReMoFP: a tool for counting function points from UML requirement models	Advances in Software …	2011
[5, 6, 31, 33]	['jKFPiSIAAAAJ', 'Pm1pEQUAAAAJ', 'GsQvP_oAAAAJ']	/scholar?cites=3935710896746450184&as_sdt=2005&sciodt=0,5&hl=en	Publication	NA	True	1	13	https://www.worldscientific.com/doi/abs/10.1142/S0218194016500261	PublicationSource.PUBLICATION_SEARCH_SNIPPET	/citations?hl=en&xsrf=&continue=/scholar%3Fq%3DRegression%2Banalysis%2Bbased%2Bsoftware%2Beffort%2Bestimation%2Bmethod%26hl%3Den%26as_sdt%3D0,5&citilm=1&update_op=library_add&info=CM00UzV0njYJ&ei=w3fcZezxLZiCy9YPqICOgAg&json=	/scholar?q=related:CM00UzV0njYJ:scholar.google.com/&scioq=Regression+analysis+based+software+effort+estimation+method&hl=en&as_sdt=0,5	/scholar?hl=en&q=info:CM00UzV0njYJ:scholar.google.com/&output=cite&scirp=0&hl=en	Estimating the development effort of a software project in the early stages of the software life cycle is a significant task. Accurate estimates help project managers to overcome the problems regarding budget and time overruns. This paper proposes a new multiple linear regression analysis based effort estimation method, which has brought a different perspective to the software effort estimation methods and increased the success of software effort estimation processes. The proposed method is compared with standard Use Case	Y{\"u}calar, Fatih and Kilinc, Deniz and Borandag, Emin and Ozcift, Akin	yucalar2016regression	NA	NA	International Journal of Software Engineering and Knowledge Engineering	NA	NA	05	NA	807--826	article	2016	World Scientific	NA	Regression analysis based software effort estimation method	International Journal of …	26
[4, 5, 6, 31, 33]	['81M-rsEAAAAJ', '8XwleNkAAAAJ', 'ZfB44aoAAAAJ']	NA	Publication	NA	True	1	0	https://dl.acm.org/doi/abs/10.1145/1921705.1921710	PublicationSource.PUBLICATION_SEARCH_SNIPPET	/citations?hl=en&xsrf=&continue=/scholar%3Fq%3DReliability%2Bof%2Btransaction%2Bidentification%2Bin%2Buse%2Bcases%26hl%3Den%26as_sdt%3D0,5&citilm=1&update_op=library_add&info=pLe7OYx8-oYJ&ei=LXfcZfvYPLDDy9YPzfW0sAI&json=	/scholar?q=related:pLe7OYx8-oYJ:scholar.google.com/&scioq=Reliability+of+transaction+identification+in+use+cases&hl=en&as_sdt=0,5	/scholar?hl=en&q=info:pLe7OYx8-oYJ:scholar.google.com/&output=cite&scirp=0&hl=en	Context: The concept of transaction is used in Use Case Points (UCP), and in many other functional size measurement methods, to capture the smallest unit of functionality that should be considered while measuring the size of a system. Unfortunately, in the case of the UCP method many different definitions of use-case transaction (and approaches to their identification) have been proposed thus far. Therefore, a question arises whether all of them define the same concept, and do they provide similar results when used by different people	Ochodek, Miros{\l}aw and Alchimowicz, Bartosz and Jurkiewicz, Jakub and Nawrocki, Jerzy	ochodek2010reliability	Proceedings of the Workshop on Advances in Functional Size Measurement and Effort Estimation	NA	NA	NA	NA	NA	NA	1--8	inproceedings	2010	NA	NA	Reliability of transaction identification in use cases	Proceedings of the …	NA
[1, 2, 3, 4, 5, 6, 31, 32, 33]	['', 'ePEmOzIAAAAJ']	/scholar?cites=2068210660337669232&as_sdt=2005&sciodt=0,5&hl=en	Publication	https://www.emerald.com/insight/content/doi/10.1016/j.aci.2019.03.002/full/pdf	True	1	9	https://www.emerald.com/insight/content/doi/10.1016/j.aci.2019.03.002/full/html	PublicationSource.PUBLICATION_SEARCH_SNIPPET	/citations?hl=en&xsrf=&continue=/scholar%3Fq%3DRevised%2Bapproach%2Bfor%2Bthe%2Bprediction%2Bof%2Bfunctional%2Bsize%2Bof%2Bmobile%2Bapplication%26hl%3Den%26as_sdt%3D0,5&citilm=1&update_op=library_add&info=cFQaQqPCsxwJ&ei=vxm6ZaS0HumV6rQP866UsAQ&json=	/scholar?q=related:cFQaQqPCsxwJ:scholar.google.com/&scioq=Revised+approach+for+the+prediction+of+functional+size+of+mobile+application&hl=en&as_sdt=0,5	/scholar?hl=en&q=info:cFQaQqPCsxwJ:scholar.google.com/&output=cite&scirp=0&hl=en	Mobile applications affect our everyday activities and have become more and more information centric. Effort estimation for mobile application is an essential factor to consider in the development cycle. Due to feature complexities and size, effort estimation of mobile applications poses a continued challenge for developers. This paper attempts to adapt COSMIC Function Point and Unified Modeling Language (UML) techniques to estimate the size of a given mobile application. The COSMIC concepts capture data movements of the	Mushtaq, Ziema and Wahid, Abdul	mushtaq2024revised	NA	NA	Applied Computing and Informatics	NA	NA	1/2	NA	181--193	article	2024	Emerald Publishing Limited	NA	Revised approach for the prediction of functional size of mobile application	Applied Computing and Informatics	20
[4, 33]	['TQMpoh8AAAAJ', '', '', 'QC1WpRAAAAAJ']	NA	Publication	https://core.ac.uk/download/pdf/35344808.pdf	True	1	0	https://link.springer.com/content/pdf/10.1007/978-3-642-27207-3.pdf	PublicationSource.PUBLICATION_SEARCH_SNIPPET	/citations?hl=en&xsrf=&continue=/scholar%3Fq%3DSoftware%2BEngineering,%2BBusiness%2BContinuity,%2Band%2BEducation%26hl%3Den%26as_sdt%3D0,5&citilm=1&update_op=library_add&info=70qFlIFfqDoJ&ei=rGDwZfvMC--p6rQPtuemqAY&json=	/scholar?q=related:70qFlIFfqDoJ:scholar.google.com/&scioq=Software+Engineering,+Business+Continuity,+and+Education&hl=en&as_sdt=0,5	/scholar?hl=en&q=info:70qFlIFfqDoJ:scholar.google.com/&output=cite&scirp=0&hl=en	We would like to welcome you to the proceedings of the 2011 International Conference on Advanced Software Engineering and Its Applications (ASEA 2011), Disaster Recovery and Business Continuity (DRBC 2011) and Education and Learning (EL 2011)—the partnering events of the Third International Mega-Conference on Future-Generation Information Technology (FGIT 2011) held during December 8–10, 2011, at Jeju Grand Hotel, Jeju Island, Korea. ASEA, DRBC and EL are focused on various aspects of advances in software	Adeli, Tai-hoon Kim Hojjat and Kang, Haeng-kon Kim Heau-jo and Kiumi, Kyung Jung Kim Akingbehin and Kang, Byeong-Ho	adelisoftware	NA	NA	NA	NA	NA	NA	NA	NA	article	NA	Springer	NA	Software Engineering, Business Continuity, and Education	NA	NA
[33]	['', '', '']	/scholar?cites=9445690911157842770&as_sdt=5,33&sciodt=0,33&hl=en	Publication	https://www.researchgate.net/profile/Bozena-Sera/publication/272173327_Influence_of_plasma_treatment_on_wheat_and_oat_germination_and_early_growth/links/54e10b6d0cf2953c22b98ddb/Influence-of-plasma-treatment-on-wheat-and-oat-germination-and-early-growth.pdf	True	1	360	https://ieeexplore.ieee.org/abstract/document/5549925/	PublicationSource.PUBLICATION_SEARCH_SNIPPET	/citations?hl=en&xsrf=&continue=/scholar%3Fq%3DSERA%2B2010%26hl%3Den%26as_sdt%3D0,33&citilm=1&update_op=library_add&info=UvOymdbVFYMJ&ei=zmDwZbqLFZfHy9YPrZeb0Aw&json=	/scholar?q=related:UvOymdbVFYMJ:scholar.google.com/&scioq=SERA+2010&hl=en&as_sdt=0,33	/scholar?hl=en&q=info:UvOymdbVFYMJ:scholar.google.com/&output=cite&scirp=0&hl=en	The aim of this paper is to show and discuss the influence of cold plasma treatment on a  germination enhancement of wheat and oat caryopses in wider context. Wheat and oat corns	Sera, Bo{\v{z}}ena and Spatenka, Petr and S̆er{\`y}, Michal and Vrchotova, Nad{\v{e}}{\v{z}}da and Hruskova, Iveta	sera2010influence	NA	NA	IEEE Transactions on Plasma Science	NA	NA	10	NA	2963--2968	article	2010	IEEE	NA	Influence of plasma treatment on wheat and oat germination and early growth	… on Plasma Science	38
[4, 5, 6, 31, 33]	['81M-rsEAAAAJ', 'TyK1FQsAAAAJ', '']	/scholar?cites=15895530384192319352&as_sdt=5,33&sciodt=0,33&hl=en	Publication	https://romisatriawahono.net/lecture/rm/paper/Ochodek%20-%20Simplifying%20effort%20estimation%20based%20on%20Use%20Case%20Points%20-%202011.pdf	True	1	208	https://www.sciencedirect.com/science/article/pii/S095058491000176X	PublicationSource.PUBLICATION_SEARCH_SNIPPET	/citations?hl=en&xsrf=&continue=/scholar%3Fq%3DSimplifying%2Beffort%2Bestimation%2Bbased%2Bon%2BUse%2BCase%2BPoints%26hl%3Den%26as_sdt%3D0,33&citilm=1&update_op=library_add&info=eC82kqpEmNwJ&ei=onfcZa_XBPXMy9YPpY2Q0A8&json=	/scholar?q=related:eC82kqpEmNwJ:scholar.google.com/&scioq=Simplifying+effort+estimation+based+on+Use+Case+Points&hl=en&as_sdt=0,33	/scholar?hl=en&q=info:eC82kqpEmNwJ:scholar.google.com/&output=cite&scirp=0&hl=en	CONTEXT: The Use Case Points (UCP) method can be used to estimate software development effort based on a use-case model and two sets of adjustment factors relating to the environmental and technical complexity of a project. The question arises whether all of these components are important from the effort estimation point of view. OBJECTIVE: This paper investigates the construction of UCP in order to find possible ways of simplifying it. METHOD: The cross-validation procedure was used to compare the accuracy of the different	Ochodek, Miroslaw and Nawrocki, Jerzy and Kwarciak, K	ochodek2011simplifying	NA	NA	Information and Software Technology	NA	NA	3	NA	200--213	article	2011	Elsevier	NA	Simplifying effort estimation based on Use Case Points	Information and Software Technology	53
[1, 2, 3, 4, 5, 6, 31, 32, 33]	['7FpDNzYAAAAJ', 'nKgzDp4AAAAJ']	/scholar?cites=8730580947744121287&as_sdt=2005&sciodt=0,5&hl=en	Publication	NA	True	1	9	https://www.worldscientific.com/doi/abs/10.1142/S0218194018500079	PublicationSource.PUBLICATION_SEARCH_SNIPPET	/citations?hl=en&xsrf=&continue=/scholar%3Fq%3DSize%2Band%2Beffort%2Bestimation%2Bbased%2Bon%2Bproblem%2Bdomain%2Bmeasures%2Bfor%2Bobject-oriented%2Bsoftware%26hl%3Den%26as_sdt%3D0,5&citilm=1&update_op=library_add&info=x-EUiR1BKXkJ&ei=pXXcZcW7G6O66rQP67aHgAY&json=	/scholar?q=related:x-EUiR1BKXkJ:scholar.google.com/&scioq=Size+and+effort+estimation+based+on+problem+domain+measures+for+object-oriented+software&hl=en&as_sdt=0,5	/scholar?hl=en&q=info:x-EUiR1BKXkJ:scholar.google.com/&output=cite&scirp=0&hl=en	This paper analyzes the correlations between the problem domain measures such as the number of distinct nouns and distinct verbs in the requirements artifacts and the solution domain measures such as the number of software classes and methods in the corresponding object-oriented software. For this purpose, 14 completed software development projects of a CMMI Level-3 certified defense industry company have been analyzed. The observed strong correlation is taken as the indication of linear relationship	Ayyildiz, T{\"u}lin Er{\c{c}}elebi and Ko{\c{c}}yi{\u{g}}it, Altan	ayyildiz2018size	NA	NA	International Journal of Software Engineering and Knowledge Engineering	NA	NA	02	NA	219--238	article	2018	World Scientific	NA	Size and effort estimation based on problem domain measures for object-oriented software	International Journal of Software …	28
[6, 9, 33, 34]	['', 'Op4M4Y0AAAAJ']	/scholar?cites=16577581173007753938&as_sdt=5,33&sciodt=0,33&hl=en	Publication	NA	True	1	275	https://onlinelibrary.wiley.com/doi/abs/10.1111/j.1467-9310.2009.00569.x	PublicationSource.PUBLICATION_SEARCH_SNIPPET	/citations?hl=en&xsrf=&continue=/scholar%3Fq%3DSocial%2BResponsibility%2Bby%2BOpen%2BInnovation%26hl%3Den%26as_sdt%3D0,33&citilm=1&update_op=library_add&info=0qJUvD5mD-YJ&ei=u1_wZen-MLec6rQPptSWqA8&json=	/scholar?q=related:0qJUvD5mD-YJ:scholar.google.com/&scioq=Social+Responsibility+by+Open+Innovation&hl=en&as_sdt=0,33	/scholar?hl=en&q=info:0qJUvD5mD-YJ:scholar.google.com/&output=cite&scirp=0&hl=en	the concept of open innovation within the context of corporate social responsibility. It   Overall, this research demonstrates the value of an open innovation approach driven by the	Holmes, Sara and Smart, Palie	holmes2009exploring	NA	NA	R\&d Management	NA	NA	4	NA	394--409	article	2009	Wiley Online Library	NA	Exploring open innovation practice in firm-nonprofit engagements: a corporate social responsibility perspective	R&d Management	39
[4, 5, 6, 33]	['', '']	/scholar?cites=16787734873979323867&as_sdt=2005&sciodt=0,5&hl=en	Publication	https://www.iceaaonline.com/wp-content/uploads/2017/07/SW06-Paper-Rosa-Software-Effort-Estimation-Models.pdf	True	1	2	https://www.iceaaonline.com/wp-content/uploads/2017/07/SW06-Paper-Rosa-Software-Effort-Estimation-Models.pdf	PublicationSource.PUBLICATION_SEARCH_SNIPPET	/citations?hl=en&xsrf=&continue=/scholar%3Fq%3DSoftware%2BEffort%2BEstimation%2BModels%2Bfor%2BContract%2BCost%2BProposal%2BEvaluation%26hl%3Den%26as_sdt%3D0,5&citilm=1&update_op=library_add&info=24X5MuwD-ugJ&ei=lF_wZe-YBsDLy9YP3uyAuAQ&json=	/scholar?q=related:24X5MuwD-ugJ:scholar.google.com/&scioq=Software+Effort+Estimation+Models+for+Contract+Cost+Proposal+Evaluation&hl=en&as_sdt=0,5	/scholar?hl=en&q=info:24X5MuwD-ugJ:scholar.google.com/&output=cite&scirp=0&hl=en	Context: An effort estimation model at early phase is not very useful if you don't have a logical approach for specifying the size measure and other input variables. Goal: This study provides a set of practical effort estimation models for software development projects during the contract bidding phase. The first set predicts effort using the entire dataset. The second set predicts effort for agile software development based on data from 20 completed projects using agile methods. Method: The analysis explores the combined effect of product size	Rosa, Wilson and Wallshein, Corinne	rosa2017software	NA	NA	NA	NA	NA	NA	ICEAA Professional Development \& Training Workshop	NA	inproceedings	2017	NA	NA	Software Effort Estimation Models for Contract Cost Proposal Evaluation	NA	NA
[4, 5, 6, 33]	['']	/scholar?cites=18103844621253193675&as_sdt=2005&sciodt=0,5&hl=en	Publication	NA	True	1	3	https://www.igi-global.com/chapter/software-effort-estimation-for-successful-software-application-development/247539	PublicationSource.PUBLICATION_SEARCH_SNIPPET	/citations?hl=en&xsrf=&continue=/scholar%3Fq%3DSoftware%2BEffort%2BEstimation%2Bfor%2BSuccessful%2BSoftware%2BApplication%2BDevelopment%26hl%3Den%26as_sdt%3D0,5&citilm=1&update_op=library_add&info=y6-pxsPGPfsJ&ei=cVrwZY7cDtOvy9YPsYKm6A4&json=	/scholar?q=related:y6-pxsPGPfsJ:scholar.google.com/&scioq=Software+Effort+Estimation+for+Successful+Software+Application+Development&hl=en&as_sdt=0,5	/scholar?hl=en&q=info:y6-pxsPGPfsJ:scholar.google.com/&output=cite&scirp=0&hl=en	The recent advancements in information and communication technology (ICT) have inspired all the operational domains of both public and private sector enterprise to endorse this technology. Software development plays a crucial role in supporting ICT. Software effort estimation serves as a critical factor in software application development, and it helps application development teams to complete the development process on time and within budget. Many developmental approaches have been used for software effort estimation, but	Saif, Syed Mohsin	saif2020software	Tools and Techniques for Software Development in Large Organizations: Emerging Research and Opportunities	NA	NA	NA	NA	NA	NA	45--97	incollection	2020	IGI Global	NA	Software Effort Estimation for Successful Software Application Development	Tools and Techniques for Software Development in …	NA
[6, 33]	['PCU9bnUAAAAJ', '', 'XAboVjwAAAAJ', 'vxWlys4AAAAJ', 'JcyHeLYAAAAJ']	NA	Publication	https://www.researchgate.net/profile/Donatien-Koulla-Moulla/publication/375551430_Functional_Size_Measurement_for_X86_Assembly_Programs/links/654e624c3fa26f66f4ed2c7f/Functional-Size-Measurement-for-X86-Assembly-Programs.pdf	True	1	0	https://www.researchgate.net/profile/Donatien-Koulla-Moulla/publication/375551430_Functional_Size_Measurement_for_X86_Assembly_Programs/links/654e624c3fa26f66f4ed2c7f/Functional-Size-Measurement-for-X86-Assembly-Programs.pdf	PublicationSource.PUBLICATION_SEARCH_SNIPPET	/citations?hl=en&xsrf=&continue=/scholar%3Fq%3DFunctional%2Bsize%2Bmeasurement%2Bfor%2BX86%2Bassembly%2Bprograms%26hl%3Den%26as_sdt%3D0,5&citilm=1&update_op=library_add&info=vFofiI_mBWMJ&ei=PnjcZaGsCsCOy9YPlbSLgAg&json=	/scholar?q=related:vFofiI_mBWMJ:scholar.google.com/&scioq=Functional+size+measurement+for+X86+assembly+programs&hl=en&as_sdt=0,5	/scholar?hl=en&q=info:vFofiI_mBWMJ:scholar.google.com/&output=cite&scirp=0&hl=en	Functional size measurement (FSM) provides a reliable and objective way to measure productivity and estimate the effort required for software activities. FSM automation, compared to manual measurement, enables to reduce errors, increase consistency, and improve the efficiency of the measurement process. This paper presents a COSMIC-based automated FSM for X86 assembly programs widely used in personal computers and servers. The proposed approach applies the COSMIC-ISO 19761 rules for sizing Functional User	Moulla, Donatien Koulla and Kitikil, Abdel Aziz and Mnkandla, Ernest and Soubra, Hassan and Abran, Alain	moulla2023functional	NA	NA	NA	NA	NA	NA	NA	NA	article	2023	CEUR-WS	NA	Functional size measurement for X86 assembly programs	NA	NA
[6, 33]	['']	/scholar?cites=12935609187881688758&as_sdt=5,33&sciodt=0,33&hl=en	Publication	https://genderlawjustice.org/s/Brief-Reflections_Wing.pdf	True	1	174	https://heinonline.org/hol-cgi-bin/get_pdf.cgi?handle=hein.journals/berkwolj6&section=21	PublicationSource.PUBLICATION_SEARCH_SNIPPET	/citations?hl=en&xsrf=&continue=/scholar%3Fq%3DWhite%2BBox%2BEstimation%25E2%2580%2593Theorie%2Bund%2BPraxis%26hl%3Den%26as_sdt%3D0,33&citilm=1&update_op=library_add&info=tp73RAWEhLMJ&ei=R3jcZdrvJ7DDy9YPzfW0sAI&json=	/scholar?q=related:tp73RAWEhLMJ:scholar.google.com/&scioq=White+Box+Estimation%E2%80%93Theorie+und+Praxis&hl=en&as_sdt=0,33	/scholar?hl=en&q=info:tp73RAWEhLMJ:scholar.google.com/&output=cite&scirp=0&hl=en	together to serve the needs of four white people living in a 2000 square foot "city cottage." "Of   It is estimated that less than 50% of all black men are actually in the work force.73 The life	Wing, Adrien Katherine	wing1990brief	NA	NA	Berkeley Women's LJ	NA	NA	NA	NA	181	article	1990	HeinOnline	NA	Brief reflections toward a multiplicative theory and praxis of being	Berkeley Women's LJ	6
[4, 6, 31, 33]	['8VmTqC4AAAAJ', 'qiOHkc4AAAAJ']	NA	Publication	NA	True	1	0	https://www.igi-global.com/article/software-estimation-framework-for-mobile-application-projects/230350	PublicationSource.PUBLICATION_SEARCH_SNIPPET	/citations?hl=en&xsrf=&continue=/scholar%3Fq%3DSoftware%2BEstimation%2BFramework%2Bfor%2BMobile%2BApplication%2BProjects%26hl%3Den%26as_sdt%3D0,5&citilm=1&update_op=library_add&info=wl82johKfw8J&ei=y3bcZe2tGLDDy9YPzfW0sAI&json=	/scholar?q=related:wl82johKfw8J:scholar.google.com/&scioq=Software+Estimation+Framework+for+Mobile+Application+Projects&hl=en&as_sdt=0,5	/scholar?hl=en&q=info:wl82johKfw8J:scholar.google.com/&output=cite&scirp=0&hl=en	As mobile devices are becoming the primary access channels for information, the authors need to have accurate effort estimation model for mobile application projects. In this paper the authors discuss “Mobile application estimation framework” that was designed based on 14 mobile application projects and was validated against 5 mobile application projects. In this paper the authors discuss the estimation framework for both native/hybrid mobile application projects and mobile web application projects. The proposed “Mobile application	Kumar, Shailesh and Koppar, Anant R	kumar2019software	NA	NA	International Journal of Productivity Management and Assessment Technologies (IJPMAT)	NA	NA	2	NA	26--40	article	2019	IGI Global	NA	Software Estimation Framework for Mobile Application Projects	International Journal of Productivity …	7
